Year,Event name,Entites,Terms
1986,Spain and Portugal join European Economic Community (Jan. 1).,"spain, portugal","Spain, Portugal, European Economic"
1986,President freezes Libyan assets in the U.S. (Jan. 8).,"libyan, libya","froze libyan, order freeze"
1986,"Space shuttle Challenger explodes after launch at Cape Canaveral, Fla., killing all seven aboard (Jan. 28).","space, shuttle","space shuttle, challenger disaster"
1986,Haiti president Jean-Claude Duvalier flees to France (Feb. 7).,"haiti, duvalier",JeanClaude Duvalier
1986,"President Marcos flees Philippines after ruling 20 years, as newly elected Corazon Aquino succeeds him (Feb. 26).","marcos, philippines","Ferdinand Marcos, Corazon Aquino"
1986,Prime Minister Olof Palme of Sweden shot dead (Feb. 28).,"palme, sweden",Olof Palme
1986,Austrian president Kurt Waldheim's service as a Nazi army officer revealed (March 3).,"waldheim, nazi, austria, austrian",Kurt Waldheim
1986,Desmond Tutu elected archbishop in South Africa (April 14).,"tutu, archbishop",Desmond Tutu
1986,Major nuclear accident at the Soviet Union's Chernobyl power station alarms the world (April 26 et seq.).,"nuclear, soviet, chernobyl",Chernobyl
1986,Supreme Court reaffirms abortion rights (June 11).,abortion,abortion
1986,World Court rules U.S. broke international law in mining Nicaraguan waters (June 27).,"nicaraguan, nicaragua",nicaragua
1986,Congress overrides Reagan veto of stiff sanctions against South Africa (Sept. 29 and Oct. 2).,"reagan, sanction, south africa","AntiApartheid Act, AntiApartheid"
1986,"Congress approves immigration bill barring hiring of illegal aliens, with amnesty provision (Oct. 17).","immigration, alien","immigration, illegal immigration, illegal immigrant"
1987,Supreme Court rules Rotary Clubs must admit women (May 4).,women,"rotary, rotary membership"
1987,Iraqi missiles kill 37 in attack on U.S. frigate Stark in the Persian Gulf (May 17); Iraqi president apologizes (May 18).,"iraqi, iraq, iran, persian",stark incident
1987,"Admiral John M. Poindexter, former National Security Adviser, testifies he authorized the use of Iran arms sale profits to aid Contras (July 15–22).","iran, contra, reagan, nicaragua, nicaraguan, lebanon",Irancontra
1988,U.S. and Canada reach a free trade agreement (Jan. 2).,canada,CanadaUnited
1988,"Robert C. McFarlane, former National Security Adviser, pleads guilty in the Iran-Contra case (March 11).",mcfarlane,"McFarlane, Irancontra"
1988,Plane blast kills Pakistani president Mohammad Zia ul-Haq (Aug. 17).,"pakistan, pakistani, ulhaq",Muhammad ZiaulHaq
1988,"Benazir Bhutto, first Islamic woman prime minister, chosen to lead Pakistan (Dec. 2).","benazir, bhutto",Benazir Bhutto
1989,Iran's Ayatollah Khomeini declares author Salman Rushdie's book The Satanic Verses offensive and sentences him to death (Feb. 14).,"iran, ayatollah, khomeini, rushdie","Salman Rushdie, Satanic Verse,  Satanic Verses"
1989,Tens of thousands of Chinese students take over Beijing's Tiananmen Square in a rally for democracy (April 19 et seq.).,"china, chinese, democracy",Tiananmen Square
1989,Mikhail S. Gorbachev named Soviet president (May 25).,"gorbachev, soviet, russia","Mikhail Gorbachev, Gorbachev"
1989,Deng Xiaoping resigns from China's leadership (Nov. 9).,"xiaoping, china, chinese",Deng Xiaoping
1989,"After 28 years, the Berlin Wall is open to the West (Nov. 11).","berlin, wall",berlin wall
1989,Czech Parliament ends Communists' dominant role (Nov. 30).,"czech, communist, communism",velvet revolution
1989,Dalai Lama wins Nobel Peace Prize.,"dalai, lama",dalai lama
1990,"World Wide Web debuts, popularizes Internet.",internet,internet
1990,Gen. Manuel Noriega surrenders in Panama (Jan. 3).,"noriega, panama",Manuel Noriega
1990,Yugoslav Communists end a 45-year monopoly of power (Jan. 22).,"yugoslav, communist, communism","Yugoslav Communist, Yugoslavia"
1990,"South Africa frees Nelson Mandela, imprisoned for 27.5 years (Feb. 11).","nelson, mandela","Nelson Mandela, mandela"
1990,Hubble Space Telescope launched (April 25).,"hubble, telescope, space,","Hubble Space, Space Telescope, hubble telescope"
1990,"Iraqi troops invade Kuwait and seize petroleum reserves, setting off the Persian Gulf War (Aug. 2 et seq.).","iraqi, iraq, kuwait, persian, gulf ","Persian Gulf, gulf war"
1990,East and West Germany reunited (Oct. 3).,"germany, german","germany, German reunification"
1990,Gorbachev assumes emergency powers (Nov. 17).,gorbachev,emergency privatization
1990,Leaders of 34 nations in Europe and North America proclaim a united Europe (Nov. 21).,"united, european, europe",united europe
1990,Margaret Thatcher resigns as British prime minister (Nov. 22); John Major succeeds her (Nov. 28).,thatcher,Margaret Thatcher
1990,Haiti elects a leftist priest as president in the first democratic election (Dec. 17).,haiti,JeanBertrand Aristide
1991,U.S. and Allies at war with Iraq (Jan. 15).,iraq,"gulf war, persian gulf"
1991,Warsaw Pact dissolves military alliance (Feb. 25).,warsaw,warsaw pact
1991,Cease-fire ends Persian Gulf War; UN forces are victorious (April 3).,"persian, gulf","gulf war, persian gulf"
1991,France agrees to sign 1968 treaty banning the spread of atomic weapons (June 3).,atomic weapon,nuclear NonProliferation 
1991,South African Parliament repeals apartheid laws (June 5).,"africa,apartheid",apartheid
1991,Boris N. Yeltsin inaugurated as the first freely elected president of the Russian Republic (July 10).,"yeltsin, russia, russian",Boris Yeltsin
1991,China accepts nuclear nonproliferation treaty (Aug. 10).,"china, chinese,",nuclear nonproliferation
1991,Israel and Soviet Union resume relations after 24 years (Oct. 18).,"israel, soviet,",IsraelRussia
1991,"U.S. indicts two Libyans in 1988 bombing of Pan Am Flight 103 over Lockerbie, Scotland (Nov. 15).",libyan,pan am
1991,"lebanon, lebanese","last three u.s. hostages, freed, lebanon, dec. 2–4",Lebanon hostage
1991,Soviet Union breaks up after President Gorbachev's resignation; constituent republics form Commonwealth of Independent States (Dec. 25).,"soviet, gorbachev, commonwealth","Soviet Union, Gorbachev"
1992,Yugoslav Federation broken up (Jan. 15).,"yugoslav, communist, communism",Yugoslavia
1992,Bush and Yeltsin proclaim formal end to the cold war (Feb. 1).,"bush, yeltsin, russia, russian, usa",cold war
1992,U.S. lifts trade sanctions against China (Feb. 21).,"china, chinese","trade sanction, china sanction"
1992,Four police officers acquitted in Los Angeles beating of Rodney King; rioting erupts in South-Central Los Angeles (April 29 et seq.).,"rodney, policemen, policeman, police, officer",rodney King
1992,Last Western hostages freed in Lebanon (June 17).,lebanon,Lebanon hostage
1992,"supreme court, reaffirms, right to abortion, june 29","supreme court, reaffirms, right to abortion, june 29",abortion
1992,Democrats nominate Bill Clinton and Al Gore (July 1).,clinton,"Bill Clinton, Al Gore"
1992,Gen. Noriega sentenced to 40 years on drug charges (July 10).,"noriega, drug",Manuel Noriega
1992,Republicans renominate Bush and Quayle (Aug. 20).,"bush, quayle","president Bush, george bush"
1992,"Top Japanese leader, Shin Kanemaru, resigns in scandal (Oct. 14).","japanese, kanemaru","Shin Kanemaru, Kanemaru Shin"
1992,"Bill Clinton elected president, Al Gore vice president; Democrats keep control of Congress (Nov. 3).",clinton,"Bill Clinton, Al Gore vice"
1992,"U.S. forces leave the Philippines, ending nearly a century of American military presence (Nov. 24).",philippines,Philippines
1992,UN approves U.S.-led force to guard food for Somalia (Dec. 3).,somalia,"somalia, Somalia intervention"
1992,Prince and Princess of Wales agree to separate (Dec. 9).,"prince, princess, wales","princess diana, prince charles"
1992,Bush pardons former Reagan administration officials involved in the Iran-Contra affair (Dec. 24).,"bush, irancontra, raegan",IranContra
1993,Clinton agrees to compromise on the military's ban on homosexuals (Jan. 29).,"clinton, homosexual, homosexuality","homosexual, military ban, DADT"
1993,U.S. begins airlift of supplies to besieged Bosnia towns (Feb. 28).,"bosnia, serbia","Bosnia Air, "
1993,Federal agents besiege Texas Branch Davidian religious cult after six are killed in the raid (March 1 et seq.).,cult,"Waco siege, Branch Davidian, Branch Davidians"
1993,Two police officers convicted on federal civil rights charges in Rodney King beating (April 17); sentenced (Aug. 4).,"police, officer, rodney",rodney king
1993,Israeli-Palestinian accord reached (Aug. 28).,"israeli, palestinian, israel, palestine","israel, palestine, Oslo Accord, Oslo Accords"
1993,China breaks nuclear test moratorium (Oct. 5).,"china, chinese, nuclear","MORATORIUM, nuclear test"
1993,Clinton signs Brady bill regulating firearms purchases (Nov. 30).,"clinton,  firearms, brady","brady law, brady bill"
1993,Toni Morrison wins the Nobel prize for literature.,"toni morrison, wins, nobel prize, literature",Toni Morrison
1994,Serbs' heavy weapons pound Sarajevo (Jan. 5–6).,"serb, serbia","Sarajevo, Siege Sarajevo, Sarajevo siege"
1994,Clinton ends trade embargo on Vietnam (Feb. 9).,"clinton,  vietnam, vietnamese",trade embargo
1994,"Rwandan genocide of Tutsis by Hutus begins; estimated 800,000 slaughtered in c. 100 days (April 6).","rwandan, genocide, tutsis, hutus","Rwandan genocide, Rwanda genocide"
1994,Israel and Palestinians sign accord (May 4).,"israel, palestinian, palestine, israeli","GazaJericho Agreement, cairo agreement"
1994,Clinton accused of sexual harassment while governor of Arkansas (May 6).,clinton,Paula Jones
1994,Congress votes protection for women's health clinics (May 12).,"women, health, woman",Women Health
1994,Supreme Court approves limit on abortion protests (June 30).,abortion,"abortion, abortion right"
1994,IRA declares cease-fire in Northern Ireland (Aug. 31).,"ira, ireland","IRA Ceasefire, ir"
1994,Aristide returns to joyous Haiti (Oct. 4).,haiti,ARISTIDE
1994,U.S. sends forces to the Persian Gulf (Oct. 7).,"persian, gulf","persian gulf, gulf war"
1994,Israel and Jordan sign peace treaty (Oct. 17).,"israel, jordan","IsraelJordan, Israel–Jordan"
1995,Senate rejects balanced-budget amendment (March 2).,budget,"BalancedBudget, Balanced Budget "
1995,UN Council votes easier sanctions for Iraq (April 14).,iraq,"iraq sanction, sanction iraq"
1995,"Scores killed as terrorist's car bomb blows up block-long Oklahoma City federal building (April 19); Timothy McVeigh, 27, Army veteran, arrested as suspect (April 21); authorities seek second suspect, link right-wing paramilitary groups to bombing (April 22).","terrorist, terrorism","Oklahoma City, Oklahoma bombing"
1995,"Death toll 2,000 in Rwanda massacre (April 22).",rwanda,Rwanda massacre
1995,U.S. shuttle docks with Russian space station (June 27).,"shuttle, russia, russian, space",space shuttle
1995,France explodes nuclear device in the Pacific; wide protests ensue (Sept. 5).,"france, nuclear","nuclear test, nuclear device"
1995,Senator Bob Packwood of Oregon resigns under pressure for sexual and official misconduct (Sept. 6).,packwood,Bob Packwoo
1995,Israelis and Palestinians agree on transferring the West Bank to Arabs (Sept. 24).,"israeli, palestinian, israel, palestine, arab","Oslo II, Oslo Accord"
1995,Million Man March draws hundreds of thousands of black men to the capital (Oct. 16).,"million, black",Million Man
1995,Quebec narrowly rejects independence from Canada (Oct. 30).,"quebec, canada",Quebec referendum
1995,Israeli prime minister Yitzhak Rabin slain by a Jewish extremist at a peace rally (Nov. 4).,"israel, israeli, yitzhak, jewish, jew",Yitzhak Rabin
1995,U.S. servicemen admit rape of Japanese schoolgirl in Okinawa (Nov. 7).,"rape, japanese, okinawa",okinawa rape
1995,Irish voters approve end to constitutional ban on divorce (Nov. 24).,"irish, ireland, divorce",divorce ban
1995,Combatants sign Bosnia peace treaty (Dec. 14).,bosnia,"Dayton Accord, Dayton Accords"
1996,U.S. budget crisis in fourth month (Jan. 3).,budget,"budget, budget crisis"
1996,France announces end to nuclear tests (Jan. 29).,nuclear,"nuclear test, nuclear testing"
1996,Suicide bombers kill 59 in Israel (March 4).,"suicide, bomber","suicide bombing, suicide bomber"
1996,Britain alarmed by deadly cow disease (March 20 et seq.).,disease,cow disease
1996,FBI arrests suspected Unabomber (April 3).,unabomber,unabomber
1996,President blocks ban on late-term abortions (April 10).,abortion,"abortion, lateterm abortion"
1996,Israel elects Benjamin Netanyahu as prime minister (May 31).,"israel, netanyahu","Benjamin Netanyahu, Netanyahu"
1996,China agrees to world ban on atomic testing (June 6).,"china, atomic, chinese","atomic testing, nuclear testing"
1996,Truck bomb kills 19 at U.S. base in Saudi Arabia (June 25).,"truck, bomb, saudi, arabia","Khobar Tower, truck bombing, truck bomb"
1996,Boris Yeltsin is reelected in Russian election (July 3).,"yeltsin, russia, russian",Boris Yeltsin
1996,Prince Charles and Princess Diana agree on divorce (July 12).,"prince, charles, princess, diana","Prince Charles, Princess Diana"
1996,Clinton signs bill to raise minimum wage (Aug. 2).,"clinton, wage",minimum wage
1996,Congress passes welfare reform bill (Aug. 2); approved by Clinton (Aug. 22).,"welfare, clinton",welfare reform
1996,"Iraqis strike at Kurdish enclave (Aug. 31); after warning, U.S. attacks Iraq's southern","iraqi, iraq, kurdish, kurd","Operation Desert, saddam hussein, kurdish enclave"
1997,Newt Gingrich reelected as House Speaker (Jan. 7).,gingrich,"Newt Gingrich, Gingrich"
1997,"Deng Xiaoping, Chinese leader, dead at 92 (Feb. 19).",xiaoping,Deng Xiaoping
1997,Heaven's Gate cult members commit mass suicide in California (March 27).,cult,"Heaven Gate, Heavens Gate"
1997,U.S. judge upholds California marijuana law (April 11).,marijuana,"marijuana law, marijuana"
1997,"Senate, 74–26, approves chemical-weapons treaty (April 24).",chemical,chemical weapon
1997,Congress votes major tax cuts (June 26).,tax,tax cut
1997,Hong Kong returns to Chinese rule (June 30).,"hong, kong, returns, chinese, china",hong kong
1997,U.S. spacecraft begins exploration of Mars (July 4).,"spacecraft, space",Mars Pathfinder
1997,U.S. spacecraft transmits thousands of pictures from Mars (Aug. 8).,"spacecraft, space, mars",Mars Pathfinder
1996,U.S. budget crisis in fourth month (Jan. 3).,"clinton, budget","budget, budget crisis"
1996,Violence flares in Jerusalem over Israel opening tourist tunnel (Sept. 24).,"jerusalem, israel, ","tunnel riot, tunnel opening"
1996,Taliban Muslim fundamentalists capture Afghan capital (Sept. 27).,"taliban, muslim, afghan",Taliban
1996,Texaco settles racial bias suit (Nov. 15).,"texaco, racial, bias","Texaco, bias suit"
1996,Clinton appoints Madeleine Albright as first female U.S. secretary of state (Dec. 5).,"clinton, madeleine, albright", Madeleine Albright
1996,FBI agent charged with spying for Moscow (Dec. 18).,"spy, moscow",Robert Hanssen
1997,Timothy J. McVeigh sentenced to death for Oklahoma City bombing (Aug. 14).,"mcveigh, oklahoma, bombing","oklahoma City, Oklahoma bombing, Timothy McVeigh "
1997,"Princess Diana, 36, killed with two others in Paris car crash (Aug. 31).","diana, queen, king, charles","princess diana, prince charles"
1997,Three Islamic suicide bombers kill four persons in Jerusalem (Sept. 4).,"islamic, suicide, bomber, jerusalem","suicide bombing, suicide bomber"
1997,Mother Teresa dead at 87 (Sept. 5).,teresa,Mother Teresa
1997,Militant Taliban leaders seize Kabul (Sept. 27).,"taliban, kabul","Taliban, kabul"
1997,Pakistani convicted in 1993 CIA killings (Nov. 10).,"pakistani,pakistan",cia killing
1997,Egyptian Islamic militants kill 62 at Luxor tourist site (Nov. 17).,"egyptian, islamic, luxor",Luxor massacre
1997,U.S. company launches first commercial spy satellite (Dec. 24).,"spy, satellite",satellite
1998,Ramzi Ahmed Yousef sentenced to life for 1993 World Trade Center bombing (Jan. 9).,"ramzi, ahmed, yousef",ramzi yousef
1998,"Palestine, Israel, intifada","president, clinton, scandal, monica, lewinsky","ClintonLewinsky, clinton lewinsky, ClintonLewinsky,  monica lewinsky"
1998,Serbs battle ethnic Albanians in Kosovo (March 5 et seq.).,"serbs, serbia, ethnic, albanian, albania, kosovo",Kosovo conflict
1998,Hindu nationalist Vajpayee becomes India's prime minister (March 19).,"hindu, vajpayee, india",Vajpayee
1998,"FDA approves Viagra, male impotence drug (March 27).","fda, viagra",viagra
1998,"Landmark peace settlement, the Good Friday Accord, reached in Northern Ireland (April 10).","friday, ireland",Good Friday
1998,"Europeans agree on single currency, the euro (May 3).","currency, euro",euro
1998,"Unabomber, Theodore Kaczynski, sentenced to four life terms (May 4).","unabomber, kaczynski","Unabomber, Theodore Kaczynski"
1998,"India conducts three atomic tests despite worldwide disapproval (May 11, 13).","india, atomic","Pokhran, Pokhranii"
1998,"Pakistan stages five nuclear tests in response to India's (May 29, 30).","pakistan, nuclear, india","IndiaPakistan, india pakistan"
1998,Congress votes to overhaul IRS (July 9).,irs,"IRS overhaul, irs, overhaul irs"
1998,U.S. embassies in Kenya and Tanzania bombed (Aug. 7).,"kenya, tanzania, bomb",Embassy Bombing
1998,Clinton admits to affair with White House intern in televised address to nation (Aug. 17).,"clinton, affair, intern","clintonLewinsky, clinton lewinsky, ClintonLewinsky, monica lewinsky"
1998,Russia fights to avert financial collapse (Aug. 17).,russia,"russian financial, russian economic"
1998,North Korea fires missile across Japan (Aug. 31).,"korea, japan",north korea
1998,Starr Report by independent counsel outlines case for impeachment proceedings against president (Sept. 11).,"starr, impeachment, president","Starr, impeachment "
1998,Senate sustains veto of bill to outlaw late-term abortions (Sept. 18).,abortion,"abortion, lateterm abortion"
1998,Iran lifts death threat against Salman Rushdie (Sept. 24).,"iran, salman, rushdie","Salman Rushdie, Satanic Verse,  Satanic Verses"
1998,U.S. budget surplus largest in three decades (Oct. 5).,budget ,Budget Surplus
1998,"Matthew Shepard, gay Wyoming student, fatally beaten in hate crime (Oct. 6).",gay,"Matthew Shepard, gay, hate crime"
1998,Former Chilean dictator Pinochet arrested in London (Oct. 16).,"chilean, chile, pinochet", Pinochet
1998,Clinton orders air strikes on Iraq (Dec. 16–19).,iraq,"bombing iraq, iraq bombing"
1998,"House impeaches President Clinton along party lines on two charges, perjury and obstruction of justice (Dec. 19).","impeach, clinton, perjury","President Clinton, bill Clinton, impeachement"
1999,NBA ends 191-day labor dispute (Jan. 6).,"nba, labor","nba, labor dispute"
1999,International Olympic Committee expels six members as bribery scandal widens (Jan. 24).,olympic ,"olympic scandal, olympic"
1999,NATO launches air strikes on Serbia to end attacks against ethnic Albanians in Kosovo (March 24).,"nato, serbia, albanian, kosovo",NATO bombing
1999,“Melissa” computer virus spreads through the Internet (March 27).,"melissa, computer, internet","melissa, computer virus"
1999,NATO bombs mistakenly hit Chinese embassy in Belgrade (May 7).,"nato, chinese, embassy, belgrade",Chinese embassy
1999,Kurd leader Abdullah Ocalan sentenced to death for treason in Turkey (June 29).,"abdullah, ocalan, treason, turkey, kurdish, kurd","Abdullah Ocalan, kurd"
1999,Taiwanese leader Lee Teng-hui challenges “One China” policy (July 11).,"taiwanese, taiwan, china, chinese","one china, taiwan"
1999,Col. Eileen Collins becomes first female to head a space shuttle mission (July 16).,"eileen, collins, space shuttle, shuttle, space","Eileen Collins, shape shuttle"
1999,Falun Gong meditation sect banned by Chinese government (July 22).,"falun, gong, meditation, chinese, china",falun gong
1999,Yeltsin replaces Prime Minister Stepashin with Vladimir Putin in fourth government shakeup in 17 months (Aug. 9).,"yeltsin, vladimir, putin",Vladimir Putin
1999,Islamic militants declare independence for Dagestan and announce holy war against Russia (Aug. 10).,"dagestan, russia, islamic, muslim, islam",holy war
1999,Israeli prime minister Ehud Barak and PLO leader Yasir Arafat announce peace accord (Sept. 4).,"Oslo Accord, oslo accords, ArabIsraeli","Oslo Accord, oslo accords, ArabIsraeli"
1999,"Larry Gene Ashbrook goes on rampage in Tex. church, killing seven and himself (Sept. 15).","Wedgwood, Church shooting","Wedgwood, Church shooting"
1999,NASA accidentally loses $125 million spacecraft as it orbits Mars (Sept. 23).,"Orbiter Crash, mars orbiter","Orbiter Crash, mars orbiter"
1999,Dozens of people exposed to radiation in Japan's worst nuclear accident (Sept. 30).,"Tokaimura nuclear, Tokaimura accident","Tokaimura nuclear, Tokaimura accident"
1999,Tobacco companies admit to harm caused by cigarette smoking (Oct. 13).,"tobacco, cigarette, smoking cigratte","tobacco, cigarette, smoking cigratte"
1999,Senate rejects 1996 nuclear test-ban treaty; international leaders upset by U.S. stand (Oct. 13).,"testban, test ban","testban, test ban"
1999,Indonesia elects Muslim leader Abdurrahman Wahid president (Oct. 20).,Abdurrahman Wahid,Abdurrahman Wahid
1999,Judge finds Microsoft to be a monopoly (Nov. 5).,microsoft,microsoft
1999,New Northern Ireland government begins self-rule for the first time in 25 years (Dec. 2).,ireland,"Good Friday, northern ireland"
1999,Muslim terrorists hijack Indian Airlines jet with 189 on board (Dec. 24).,"muslim, terrorist, terrorism, hijack, indian","Indian Airline, hijack, hijacking"
2000,"Hijackers seize Afghan plane; release hostages in Stansted, England (Feb. 6–12).","hijacker, afghan","hijacker, hijacking, hijack, afghan plane, hostage crisis"
2000,Britain ends self-rule in Northern Ireland after the Irish Republican Army misses disarmament deadline (Feb. 11).,"britain, irish, northern ireland","Northern Ireland, ira"
2000,Reformists win control of the Iranian parliament for the first time since the 1979 Islamic revolution (Feb. 26).,"reformist, iranian, iran","iran, islamic revolution"
2000,Gun maker Smith & Wesson limits the manufacture and distribution of handguns in light of lawsuits (March 17).,"gun, smith, wesson, handgun",Gun Lawsuit
2000,Microsoft loses antitrust suit; appeal expected (April 3).,"microsoft, monopoly","antitrust case, antitrust suit, microsoft"
2000,Cuban boy Elián González reunited with father after the federal raid of Miami relatives' home (April 22).,"cuban, cuba, gonzalez",Elian Gonzalez
2000,Vermont approves same-sex unions (April 25).,"vermont, samesex","samesex, same sex"
2000,“I love you” virus disrupts computers worldwide (May 4).,"virus, computer",computer virus
2000,Israeli troops withdraw from the Lebanese security zone after 22 years of occupation (May 24).,"israeli, israel, lebonan, lebanese",Israeli occupation
2000,Britain restores parliamentary powers to Northern Ireland after Sinn Fein agrees to disarm (June 4).,britain ireland,Northern Ireland
2000,"Presidents of North and South Korea sign a peace accord, ending half a century of antagonism (June 15).",korea,"Korean reunification, south korea, north korea"
2000,British find 58 bodies of illegal Asian immigrants suffocated in Dutch truck that transported them (June 20).,"asian, immigrant","Asian immigrant, chinese migrant"
2000,Human genome deciphered; expected to revolutionize the practice of medicine (June 26).,"genome, medicine","Human genome, genome, genetic engineering"
2000,"Abortion pill, RU-486, wins U.S. approval (Sept. 28).",abortion,"Abortion pill, abortion"
2000,"Palestinians and Israelis clash, spurred by the visit of right-wing Israeli leader Ariel Sharon to a joint Jewish/Muslim holy site; “Al Aksa intifada” continues unabated (Sept. 30 et seq.).","palestinian, palestine, israel, israelis, sharon, jewish, jew, islam muslim, intifada","Ariel Sharon, intifada"
2000,17 U.S. sailors on navy destroyer Cole die in Yemen terrorist explosion (Oct. 12).,"yemen, terrorist, terrorism",Cole Bombing
2000,Philippine president Joseph Estrada impeached after receiving gambling payoffs (Nov. 13).,"philippine, estrada, gambling",Joseph Estrada
2000,Global warming talks collapse at the Hague conference (Nov. 25).,"global warming, warming, hague","Global warming, Hague conference, Hague climate"
2000,Mad Cow disease alarms Europe (Nov. 30 et seq.).,"cow, disease",mad cow
2001,"In the final days of the presidency, Bill Clinton issues controversial pardons, including one for Marc Rich, a billionaire fugitive financier (Jan. 20).","clinton, financier","pardongate, marc rich, bill clinton"
2001,"Libyan convicted in Flight 103 bombing over Lockerbie, Scotland (Jan. 31).","libyan, bombing",Lockerbie bombing
2001,Right-winger Ariel Sharon wins the election in Israel (Feb. 6).,"sharon, election, israel",Ariel Sharon
2001,FBI agent Robert Hanssen is charged with spying for Russia for 15 years (Feb. 20).,"fbi, hanssen, spying, russia","Robert Hanssen, russia spy"
2001,"British livestock epidemic, foot-and-mouth disease, reaches crisis levels (March 23).","livestock,  disease","livestock epidemic, footandmouth disease, mouth disease"
2001,"Bush abandons the global-warming treaty (Kyoto Protocol), angering European leaders (March 30).","global warming, warming, global warming","globalwarming treaty, Kyoto Protocol, global warming"
2001,U.S. spy plane and Chinese jet collide. The 24 crew members of the U.S. plane are detained for 11 days; the U.S. issues a formal statement of regret (April 2 et seq.).,"usa, spy, china, chinese",Hainan Island
