Year,Event name,Entites,Terms
2001,Race riots in Cincinnati continue for several days following a shooting of an unarmed black man by a white police officer (April 7 et seq.).,"race, cincinnati, black, police",Cincinnati riot
2001,"U.S. millionaire Dennis Tito becomes the first space tourist, visiting the International Space Station aboard a Russian booster (April 28).","tito, space","Dennis Tito, space station, space tourist"
2001,"Former Klansman Thomas E. Blanton convicted of the 1963 murder of four black girls in Birmingham, Ala. (May 1).","klansman, blanton","Klansman, Thomas Blanton"
2001,Balance of the Senate shifts after Jim Jeffords of Vermont changes his party affiliation from Republican to Independent. The move strips Republicans of control of the Senate and gives Democrats the narrowest of majorities (50–49–1) (June 5).,"senate,  jeffords, party","Jim Jeffords, senate"
2001,"Bush signs a new tax-cut law, cutting taxes by $1.35 trillion over 11 years, the largest tax cut in 2 decades (June 7).","tax-cut law, tax, taxcut","taxcut law, tax cut, taxcut"
2001,"Mohammad Khatami, Iran's moderate president, is reelected in a landslide (June 9).","khatami, iran","Mohammad Khatami, iran"
2001,"Without the U.S., 178 nations reach an agreement on a climate accord, which rescues, though dilutes, the 1997 Kyoto Protocol (July 23).",climate,"globalwarming treaty, Kyoto Protocol, global warming"
2001,"Bush allows stem cell research, approving federal funds for studies using existing strains of stem cells (Aug. 9).","stem cell, research","stem cell, stemcell"
2001,"After six months of fighting, a peace agreement is signed between rebels and the Macedonian government (Aug. 13).",macedonian,Macedonian peace
2001,Budget surplus dwindles; some blame the slowing economy and the Bush tax cut (Aug. 22).,"budget, economy, tax",Budget surplus
2001,"Terrorists attack the United States. Hijackers ram jetliners into the twin towers of New York City's World Trade Center and the Pentagon. A fourth hijacked plane crashes 80 mi outside of Pittsburgh. The toll of the dead is more than 3,000. Within days, Islamic militant Osama bin Laden and the al-Qaeda terrorist network are identified as the parties behind the attacks (Sept. 11).","terrorists, hijacker, jetliner, tower, osama, bin, laden, alqaeda","terrorist, terrorism, september 11, twin tower, hijacker, hijacking, sept 11"
2001,"Anthrax scare rivets the nation, as anthrax-laced letters are sent to various media and government officials. Several die after handling the letters (October 5 et seq.).",anthrax,anthrax
2001,"In response to the Sept. 11 terrorist attacks, U.S. and British forces launch a bombing campaign against the Taliban government and al-Qaeda terrorist camps in Afghanistan. Bombings continue on a daily basis (Oct. 7 et seq.).","taliban, alqaeda, afghanistan",taliban
2001,"Irish Republican Army announces that it has begun to dismantle its weapons arsenal, marking a dramatic leap forward in the Northern Ireland peace process (Oct. 23).","irish, ireland","ira disarming, ira"
2001,"Enron Corp., one of the world's largest energy companies, files for bankruptcy (Dec. 2).",enron,"Enron scandal, enron"
2001,"Hamid Karzai, new interim Afghan leader, is sworn in (Dec. 22).",karzai,Hamid Karzai
2002,Defrocked priest John Geoghan convicted of child molestation; church's role in cover-up sparks national outrage (Jan. 18).,geoghan,John Geoghan
2002,"President Bush's first State of Union address labels Iran, Iraq, and North Korea “an axis of evil” (Jan. 29).","iran, iraq, axis","axis evil, north korea, iran, iraq"
2002,Hundreds in India die in Hindu-Muslim clashes (March 2).,"india,  hindu, muslim",HinduMuslim
2002,Saudi peace proposal—offering Israel normal relations with all Arab nations in return for withdrawal from occupied territories—approved at Arab League summit (March 28).,"saudi, arab",Arab Peace
2002,"Venezuelan president Hugo Chavez ousted in a coup, then reinstated (April 12, 14).","venezuelan, chavez, venezuela",Hugo Chavez
2002,"In a letter to the Director, FBI lawyer Coleen Rowley criticizes the FBI for thwarting terrorist efforts (May 21).",fbi,FBI
2002,U.S. abandons 31-year-old Antiballistic Missile treaty (June 13).,antiballistic,"Antiballistic,  Missile treaty, AntiBallistic Missile"
2002,"WorldCom, after admitting to misstating profits, files for bankruptcy—largest claim in U.S. history (July 21).",worldcom,WorldCom
2002,North Korea admits to developing nuclear arms in defiance of the treaty (Oct. 16).,"north korea, nuclear",north korea
2002,"chechen rebels take 763 hostages in a Moscow theater; Russian authorities release gas into the theater, killing 116 hostages and freeing the remaining survivors (Oct. 23–26).",chechen,"Moscow theater, theater hostage, theater siege"
2002,"Snipers prey upon DC suburbs, killing ten and wounding others (Oct. 2–24).",sniper,"Beltway Sniper, sniper attack, sniper"
2002,"archbishop, sexual, abuse, church","archbishop, sexual, abuse, church","Catholic Church, sexual abuse"